Job Title,Salary Estimate,Job Description,Rating,Company Name,Location,Size,Founded,Type of ownership,Industry,Sector,Revenue
Data Scientist,-1,"Who We Are

Boston Consulting Group partners with leaders in business and society to tackle their most important challenges and capture their greatest opportunities. BCG was the pioneer in business strategy when it was founded in 1963. Today, we work closely with clients to embrace a transformational approach aimed at benefiting all stakeholders—empowering organizations to grow, build sustainable competitive advantage, and drive positive societal impact.

Our diverse, global teams bring deep industry and functional expertise and a range of perspectives that question the status quo and spark change. BCG delivers solutions through leading-edge management consulting, technology and design, and corporate and digital ventures. We work in a uniquely collaborative model across the firm and throughout all levels of the client organization, fueled by the goal of helping our clients thrive and enabling them to make the world a better place.",4.4,Boston Consulting Group,Perth,10000+ Employees,1963,Company - Private,Consulting,Business Service,$5 to $10 million (USD)
Data Scientist / Data Architect,$96K - $110K (Glassdoor Est.),"ABOUT THIS ROLE

We currently require a Data Architect with a Data Scientist background to join our team on a permanent basis. This varied role provides advice and architecture / analytics / data science visioning to align technology with business visions and objectives to achieve our vision and mission. The role will be based at Anzac Park West and requires a NV1 security clearance.

KEY RESPONSIBILITIES
Undertake a stock take of data capabilities and tools to scale to an enterprise-level.
Make visualisation and business intelligence tools available to all Defence personnel.






At Jacobs, we're challenging today to reinvent tomorrow by solving the world's most critical problems for thriving cities, resilient environments, mission-critical outcomes, operational advancement, scientific discovery and cutting-edge manufacturing, turning abstract ideas into realities that transform the world for good. With $13 billion in revenue and a talent force of approximately 52,000, Jacobs provides a full spectrum of professional services including consulting, technical, scientific and project delivery for the government and private sector

0450 591 813",4.2,Kinexus,Canberra,51 to 200 Employees,2013,Non-profit Organisation,Social Services,Non-Profit,Unknown / Non-Applicable
Data Scientist,-1,"Requisition ID: 20732
Employment Type: Full time

Good things start here

This could be the very first step towards an exciting new career with us – a fresh beginning. At Coles Group, these are moments we live for.",3.7,Coles Careers,Hawthorn East,10000+ Employees,1914,Subsidiary or Business Segment,Grocery Shops & Supermarket,Retail,$10+ billion (USD)
Instructor - Part Time Data Science,-1,"In this 10-week, students learn the basis of Data Science with Python, and explore the power of applying data science algorithms and machine learning to big data sets.
We are looking for an experienced data scientist to lead this transformative experience as instructor for General Assembly's part-time Data Science course.
Skills and Qualifications
You are eager to shape the skills, minds, and trajectories of the newest generation of data scientists.
You are the person that your colleagues naturally gravitate to when they are trying to figure something out.",4.0,General Assembly,Sydney,501 to 1000 Employees,2011,Company - Private,Education Training Service,Education,Unknown / Non-Applicable
Data Analytics Analyst,-1,"We currently have a great opportunity within our Operations team for a Data Analytics Analyst to work across multiple data sets Pharmacy related: Point of Sales, Point of Dispense, Stock data, Point of Purchase, Sell in data…
The immediate scope of the work is to support the team with data quality investigations, ad -hoc data insight, reports and new processing requirements. A good understanding of sales transactions in a pharmaceutical landscape acquired from previous experience working in a pharmacy environment would be ideal in combination with sound technical skills using SQL, Python and/or R to analyse the data.
As a Data Analytics Analyst you will be responsible for the collection, processing, analysis, and administration of supplier data through to the preparation of data for reporting purposes.",3.9,IQVIA,St Leonards,10000+ Employees,2017,Company - Public,Biotech & Pharmaceutical,Biotech & Pharmaceutical,$10+ billion (USD)
"Data Visualisation, Analytics & Strategy Consultant",Employer Provided Salary:$93K - $140K,"Slalom is a purpose-driven consulting company focused on strategy, technology and business transformation. Founded in 2001, we had a simple goal - build a company where people love their work and love their life. As we continue to grow in Australia, we have a responsibility and opportunity to do good in the world. We’re committed to building our business in ways that are sustainable and responsible, while creating innovative solutions to the world’s biggest challenges. We have bold aspirations for the future and together with our people, partners and customers, we take measurable actions for today.
Job Title: Data Visualisation, Analytics & Strategy Consultant
Data visualization and storytelling is the art of analyzing disparate data, infusing business acuity, and designing outputs leveraging user-centric best practices to convey insights in an intuitive and compelling way. Your goal is drive understanding and decision making from data, from key executives down to operational analysts. You will operate at the intersection of business, analytics, and design. You will understand and help shape business requirements and design, develop, and implement visual analytics solutions for our clients.",-1,Slalom,Sydney,-1,-1,-1,-1,-1,-1
Data Scientist,$120K - $135K (Glassdoor Est.),"Fantastic Innovative Start-up Environment
Career & Development Opportunities
Awesome Culture

OUR STORY
We believe it’s time for a new type of bank. One that steps up and does the right thing by its customers; that puts them first. One that is relevant and meaningful in today’s world.
We’re that new type of bank. We’re digital only, and harness the capabilities of technology, data and artificial intelligence to deliver an entire bank in the palm of your hand. We exist solely to serve our customers - to give them a smarter, more personalised banking experience. We are constantly adapting and evolving to help customers make better, more informed financial decisions. We do things in real time, to bring real value to their lives. We put them first.
And we do this every second, of every minute, of every day.
All 86,400 of them. We’re 86 400.


You are excited to play a role in growing a fledgling data science programme and will use your understanding of advanced analytics and statistical modelling to generate insights, refine our product strategy and promote a culture of experimentation and measurement.

You’ll like to be close to the action – this role will partially embed with our product and UX teams, and will also collaborate closely with our agile delivery squads to develop triggers and models for customer-facing app features.

This role reports to the Head of Data and Analytics.


As a Data Scientist you will be expected to:




Essential
Desirable



If you are looking to look for an innovative company which adds value, then this is the role for you. A competitive package is on offer for the successful candidate.

Visit: www.86400.com.au

no agencies will be accepted in the recruitment of this role. We would like to take this opportunity to thank all candidates for their application. Our standard is that every candidate receives an outcome email or other written communication as a minimum.",-1,86 400,Sydney,51 to 200 Employees,2017,Company - Public,Banks & Building Society,Finance,Unknown / Non-Applicable
Machine Learning Engineer (Deep Learning Specialisation - mid and higher),-1,Be one of the first to Apply!,3.9,Nearmap,Sydney,201 to 500 Employees,2007,Company - Public,Computer Hardware & Software,Information Technology,Unknown / Non-Applicable
"Senior Data Scientist, Financial Crime",-1,"Requisition Title -
Senior Data Scientist, Financial Crime
Job Number: - AUS138573
Description
Contribute to and foster the development of a compliance & continuous improvement culture across ANZ
An opportunity to join an innovative, collaborative, and high-performing team
Build your career your way
About The Role",4.2,ANZ Banking Group,Australia,10000+ Employees,1835,Company - Public,Banks & Building Society,Finance,Unknown / Non-Applicable
AI Scientist - Machine Learning in NLP,$101K (Glassdoor Est.),"AI Scientist - Machine Learning in NLP-21000W5E

Applicants are required to read, write, and speak the following languages: English
Preferred Qualifications

Principal Member of Technical Staff - Digital Assistant and Bots Platform Team
We are a growing group within Oracle creating innovative products that leverage the power of AI and Machine Learning to bring world-class speech, vision and natural language capabilities to Oracle’s Digital Assistant platform. We are like a start-up inside a large company with a big charter and a lot of creative freedom. We have assembled some of the smartest people in the industry and are growing this team.",3.8,Oracle,Melbourne,10000+ Employees,1977,Company - Public,Enterprise Software & Network Solutions,Information Technology,$10+ billion (USD)
Data & Analytics Transformation Lead,-1,Be one of the first to Apply!,4.2,Novartis,Sydney,10000+ Employees,1996,Company - Public,Biotech & Pharmaceutical,Biotech & Pharmaceutical,$10+ billion (USD)
Data & Applied Scientist II,-1,"Do you have a passion for working with customers on their most forward-looking AI initiatives? We are seeking someone to develop machine learning solutions to solve the business problems our customers face every day.

The Commercial Software Engineering (CSE) team is a global engineering organization that works directly with customers looking to leverage the latest technologies to address their toughest problems and transform their industries using cloud-based solutions. We sit side-by-side with our customers to collaboratively innovate custom solutions tailored to their business challenges. In the process, we help shape the future of our own platforms by partnering with our product groups to improve them. We pride ourselves on making contributions to open source and make our platforms easier to adopt. Our work involves the development of high-impact software assets that contribute to the Microsoft platform that are broadly applicable. Our diverse skillsets and collaborative, curious natures help us foster innovation with our customers and with ourselves. Fresh perspective is part of how we create meaningful impact in our work and inclusive day-to-day experiences. We want your help in continuing to reflect the communities we serve and live in.",4.4,Microsoft,Melbourne,10000+ Employees,1975,Company - Public,Computer Hardware & Software,Information Technology,$10+ billion (USD)
Big Data Engineer,$95K - $100K (Glassdoor Est.),"Who are we?

Servian is the largest privately owned data consultancy in Australia. We embrace innovation and change, and the positive impact it has for us and our clients. All roles at Servian involve personal and technical development and career growth, so speak to us about how we can work together.

About you
Servian is a company full of smart, technology agnostic consultants. You will be a passionate and proactive self-starter who continually seeks to learn and develop your professional skill set.

The role
As a Servianite, you will work alongside a team of highly talented technical consultants that provide top quality solutions for a range of tier-1 clients across various industries (Telco, Finance, Aviation, Insurance etc). It is a great opportunity for a passionate technologist with a solid understanding of data engineering and data warehousing best practices to join a rapidly growing consultancy.",4.2,Servian,Sydney,501 to 1000 Employees,2008,Company - Private,IT Service,Information Technology,Unknown / Non-Applicable
Machine Learning Engineer,Employer Provided Salary:$110K - $130K,"About Us
mPort has designed and built a world-first automated 3D body measurement platform, transforming the phygital experience. Using thousands of point cloud data, an accurate 360-degree 3D avatar of your body is created within seconds of scanning inside the mPod. Our innovation is widely used by customers across Australia for tracking body and health improvements.
About the Opportunity
mPort is looking to hire an experienced engineer to join our Research and Development team. You must have a strong ability to translate published literature into implementation, and be able to derive new solutions based on a combination of existing solutions.",-1,mPort Ltd,Crows Nest,-1,-1,-1,-1,-1,-1
"Consultant, Data Scientist",$87K - $110K (Glassdoor Est.),"Work type: Permanent Full time
Location: Aust - VIC Metro
Enterprise Data Science is a team of passionate, creative, and diverse data scientists and engineers that shape the data and analytics landscape at the NAB.
In this role, you will support the Enterprise Data Science team by furthering our ability to drive data and analytics solutions across the organisation by:
Leading the development and delivery of machine learning solutions for our business stakeholders
Contributing to the strategy of the team and the development and delivery of an automated data science best practice process for all analytics practitioners
Contributing to the growth of a world-class data science offering",3.8,NAB - National Australia Bank,Melbourne,10000+ Employees,Company - Public,Banks & Building Society,Finance,$10+ billion (USD),-1
Data Scientist,-1,"Who We Are

Boston Consulting Group partners with leaders in business and society to tackle their most important challenges and capture their greatest opportunities. BCG was the pioneer in business strategy when it was founded in 1963. Today, we work closely with clients to embrace a transformational approach aimed at benefiting all stakeholders—empowering organizations to grow, build sustainable competitive advantage, and drive positive societal impact.

Our diverse, global teams bring deep industry and functional expertise and a range of perspectives that question the status quo and spark change. BCG delivers solutions through leading-edge management consulting, technology and design, and corporate and digital ventures. We work in a uniquely collaborative model across the firm and throughout all levels of the client organization, fueled by the goal of helping our clients thrive and enabling them to make the world a better place.",4.4,Boston Consulting Group,Perth,10000+ Employees,1963,Company - Private,Consulting,Business Service,$5 to $10 million (USD)
Data & Applied Scientist II,-1,"Do you have a passion for working with customers on their most forward-looking AI initiatives? We are seeking someone to develop machine learning solutions to solve the business problems our customers face every day.

The Commercial Software Engineering (CSE) team is a global engineering organization that works directly with customers looking to leverage the latest technologies to address their toughest problems and transform their industries using cloud-based solutions. We sit side-by-side with our customers to collaboratively innovate custom solutions tailored to their business challenges. In the process, we help shape the future of our own platforms by partnering with our product groups to improve them. We pride ourselves on making contributions to open source and make our platforms easier to adopt. Our work involves the development of high-impact software assets that contribute to the Microsoft platform that are broadly applicable. Our diverse skillsets and collaborative, curious natures help us foster innovation with our customers and with ourselves. Fresh perspective is part of how we create meaningful impact in our work and inclusive day-to-day experiences. We want your help in continuing to reflect the communities we serve and live in.",4.4,Microsoft,Melbourne,10000+ Employees,1975,Company - Public,Computer Hardware & Software,Information Technology,$10+ billion (USD)
Senior Data Scientist,-1,"Mentor other data scientists and analysts to elevate the thinking and technical ability across the organization as well as assist with presentation and delivery.

Collaborate with users and stakeholders to develop, test and document new ways to help provide data driven outcomes to the business.
Skills and experience include:
Tertiary qualifications in a STEM or business discipline
5 years+ experience in advanced data analytics or machine learning / AI / Statistics
Sound communication and influencing skills with stakeholders from a range of backgrounds",4.1,Robert Walters,North Ryde,1001 to 5000 Employees,1985,Company - Public,Staffing & Outsourcing,Business Service,$500 million to $1 billion (USD)
Data Scientist,Employer Provided Salary:$70 - $77 Per Hour,"$70 - $77 per hour plus super
Face2face Recruitment number # 551380
Contract to October 2022
Face2face Recruitment number # 551380
Contract to October 2022
Located in Canberra, ACT
Baseline clearance required
$70 - $77 per hour plus super",5.0,face2face Recruitment,Canberra,Unknown,Company - Private,Unknown / Non-Applicable,-1,-1,-1
Senior Fraud Risk Data Scientist,$125K - $145K (Glassdoor Est.),"Are you ready?

At Optus we believe that our Amazing People are central to helping us achieve our vision to be Australia’s most loved everyday brand, with lasting customer relationships.

About your role …",3.9,Optus,Sydney,5001 to 10000 Employees,1992,Subsidiary or Business Segment,"Cable, Internet & Telephone Provider",Telecommunication,$2 to $5 billion (USD)
Senior Data Scientist,-1,"Explore our passion for discovery
Global companies and governmental entities rely on us to solve their most complex data challenges. Our employees collaborate to reduce risks and create opportunities for customers in more than 100 countries. We’re adaptable, curious and ambitious. That’s why here, you’ll have the freedom to drive change, the trust to find your own path, and the space to explore more
Senior Data Scientist required at ThreatMetrix®, A LexisNexis® Risk Solutions Group, provides an end-to-end platform for digital identity intelligence and trust decisioning.
As a Senior Data Scientist , you’ll use global data from the largest real-time fraud detection platform to craft solutions for our enterprise customers. Your experience with data analysis, statistical modelling , and machine learning will lead to immediate real-world impact in the form of lower consumer friction, reduced fraud losses and as a result, increased customer profitability.",3.5,Risk Solutions,Melbourne,1001 to 5000 Employees,1968,Subsidiary or Business Segment,Advertising & Marketing,Business Service,$1 to $2 billion (USD)
Data Scientist - Health Insurance,-1,"Parramatta CBD location (flexibility to work remotely)!
Work in a close-knit team, alongside a senior who you will collaborate with!
Junior-Mid-level role for someone with strong communication skills


Parramatta CBD location (flexibility to work remotely)!
Work in a close-knit team, alongside a senior who you will collaborate with!
Junior-Mid-level role for someone with strong communication skills

We are currently seeking a junior-mid level Data Scientist to join an agile and innovative data and advanced analytics team within one of Australia’s largest healthcare insurance providers.
This role is strongly focused on understanding the business, providing insights, visualising the outcome and developing descriptive and predictive models on findings.
Being heavily data driven, strong engagements with multiple stakeholders are required across the business. You will be responsible for pushing developed initiatives across various teams within the business using ML models.


You will have 2-4 years experience as a data scientist and are at a point where you want to further develop your career within data science, workthing with a close-knit team.







If this looks like you, please apply with your CV and Cover Letter through the links below.

This position is eligible for people with full Australian work rights who can interview in person in Sydney at short-notice.",4.0,Talent Insights Group,Parramatta,1 to 50 Employees,Company - Private,Unknown / Non-Applicable,-1,-1,-1
Senior Data Scientist - Fraud Analytics (Insurance),Employer Provided Salary:$140K,Be one of the first to Apply!,4.0,Talent Insights Group,Sydney,1 to 50 Employees,Company - Private,Unknown / Non-Applicable,-1,-1,-1
Data Scientist,-1,"Data Scientist opportunity within a Government Department for an initial 8-month contract.

Your new company
You will be working with a Government Department as a Data Scientist on the Busting Congestion program.

Your new role
As a Data Scientist, help teams to understand what is possible with the data we already collect and identify additional sources of data we could consume. Identify the most appropriate sources of data for the user need and help teams operationalise these datasets into user-centred features of digital products through analysis, visualisation, predictive modelling, machine learning and more. Assist teams understand the strategic context of the data they use, including privacy, security, and regulatory obligations.


To be considered, you will need:
You must be an Australian citizen and will possess or be willing to go through the process to obtain and maintain a (NV1 Security Clearance) personnel security clearance.


In return you will secure a competitive hourly rate with an initial 8-month contract and possibility of extensions.


If you are interested in this role, please contact Antonio Musolino on (02) 6112 7621 or email Antonio.Musolino@hays.com.au. If this job isn't quite right for you, but you're looking for more opportunities in the IT industry, please contact me for a confidential discussion on your career.

#2564765",3.7,HAYS,Canberra,5001 to 10000 Employees,1968,Company - Private,Staffing & Outsourcing,Business Service,$1 to $2 billion (USD)
Asset Data Scientist,$90K - $134K (Glassdoor Est.),"Business Unit:
Asset Reliablity & Performance
Function:
Asset Management
Job Code:
702364
If you want a corporate career combined with lifestyle then V/Line can take you there. With over 2000 employees, locations throughout Melbourne and Regional Victoria and a true commitment to workplace flexibility, why not have your dream career and the lifestyle you want. We can get you there with free myki travel.",3.9,V/Line,Melbourne,1001 to 5000 Employees,Government,Transportation Management,Transportation & Logistics,Unknown / Non-Applicable,-1
Senior Data Scientist,-1,"Who We Are

Boston Consulting Group partners with leaders in business and society to tackle their most important challenges and capture their greatest opportunities. BCG was the pioneer in business strategy when it was founded in 1963. Today, we work closely with clients to embrace a transformational approach aimed at benefiting all stakeholders—empowering organizations to grow, build sustainable competitive advantage, and drive positive societal impact.

Our diverse, global teams bring deep industry and functional expertise and a range of perspectives that question the status quo and spark change. BCG delivers solutions through leading-edge management consulting, technology and design, and corporate and digital ventures. We work in a uniquely collaborative model across the firm and throughout all levels of the client organization, fueled by the goal of helping our clients thrive and enabling them to make the world a better place.


BCG GAMMA combines innovative skills in computer science, artificial intelligence, statistics, and machine learning with deep industry expertise. The BCG GAMMA team is comprised of world-class data scientists and business consultants who specialize in the use of advanced analytics to get breakthrough business results. Our teams own the full analytics value-chain end to end: framing new business challenges, building fact-bases, designing innovative algorithms, creating scale through designing tools and apps, and training colleagues and clients in new solutions.",4.4,Boston Consulting Group,Perth,10000+ Employees,1963,Company - Private,Consulting,Business Service,$5 to $10 million (USD)
