Job Title,Salary Estimate,Job Description,Rating,Company Name,Location,Size,Founded,Type of ownership,Industry,Sector,Revenue
Data Scientist,-1,"About us

With more than 160 years of history, we are proud of our position in the community with more satisfied customers than any other Australian bank. Every day, we work hard to bring our company purpose to life, feeding into the success of our customers and communities and not off it.

We're more than just a bank with banking products. We change the lives of customers and communities. Commercial actions with heart!

Our time is now. We are challenging the status quo and we're excited about our future!

About the role

We have a role available focusing on key data science capability supporting the Lending Process Automation project to work on the Optical Character Recognition development.

This role reports into the Data Insights Service Owner, within the Customer & Data Enablement Practice (C&DE). C&DE specialises in the application of deep statistical analytics to solve complex business problems. Working across the three pillars of analysis (Descriptive, Predictive, Prescriptive).


Proactively seek and suggest improvements to existing processes, outlining any risks and recommend optimal solutions
Ensure appropriate fail-over and exception-handling is fully incorporated in deployed automated solutions
Work closely with business analyst, project managers, product owners, and functional experts (business) to validate technical integration and development conforms to requirements
Work with SMEs to illicit requirements
Manage change requests to support development and maintenance

About you

You will have knowledge of Python, Pandas, Machine Learning and AI techniques (e.g. supervised and un-supervised machine learning techniques, statistical analysis, NLP)


Sound understanding of Python and Pandas and of software engineering practices (unit testing, version control (Git), code review)
Deep experience of data manipulation/wrangling techniques for unstructured data
Experience with AWS services (S3, Lambda, SNS, SQS)
Experience using Data Science platforms (e.g. Databricks) or frameworks (e.g. Tensorflow, PyTorch, scikit-learn)
Experience with Optical Character Recognition (OCR) technology such as AWS Textract would be desirable
Experience with containerisation (e.g. Docker, Kubernetes) would be desirable

Why us?

There's so much more to a career with Bendigo and Adelaide Bank than just banking.

Get real benefits, work life balance and flexibility. You bring your brilliant mind and we’ll help you take your learning to the next level with on the job training and external development opportunities - we want you to shine. After all, YOU are the difference that makes us the better big bank.

At Bendigo and Adelaide Bank we believe a diverse workforce supported by an inclusive culture is central to our success and we actively encourage applications from those who bring diversity of thought to our business. We support candidate requests for adjustment to accommodate an illness, injury or disability to equitably participate in the selection process.

Be quick to apply as applications will be reviewed as they are submitted, and the advert may close before the listed closing date.",3.6,Bendigo & Adelaide Bank,Remote,5001 to 10000 Employees,Subsidiary or Business Segment,Investment Banking & Asset Management,Finance,$2 to $5 billion (USD),-1
"Data Scientist, Data Engineer and Data Analyst - Multiple Roles",-1,"Job Details

JOB TITLE - Data Scientist, Data Engineer and Data Analyst - Multiple Roles

EMPLOYMENT TYPE - Ongoing Full time

LOCATION - ACT; NSW; QLD; VIC

AFP BAND & SALARY - Band 07, 105,974.00 - 113,500.00

JOB REFERENCE NUMBER - 7596

CONTACT OFFICER - Matthew Curtis, Phone: 0251264681, Email: matt.curtis@afp.gov.au

APPLICATIONS CLOSE - 11:59pm (AEST) 27/10/2021

This advertisement is to fill current vacancies and create a merit pool for future vacancies arising over the next 12 months.

Australian Federal Police

Policing for a safer Australia - the world is changing, crime is changing, we are changing to meet new challenges.

The mission of the AFP is to provide dynamic and effective law enforcement to the people of Australia. It provides policing throughout Australia in relation to the prevention and detection of crimes against the Commonwealth, its laws and integrity, and community police services to the Community of the ACT.

Applications are invited from suitably qualified people who are interested in an appointment to the AFP. Applicants should demonstrate a commitment to the core values of the AFP, and their application must address selection criteria and the relevant work level standards.

The AFP offers a generous remuneration and conditions package, full details can be found here.

As an inclusive organisation, the AFP provides opportunity for all Australians to fairly gain employment in the AFP. We appreciate that everyone is unique and acknowledge that diversity in thought leads to greater transparency and improved consideration in our decision making. To support our employees we also provide flexible work arrangements.

Role Summary

The Australian Federal Police (AFP) is a key player in the Australian security landscape that rises to complex challenges and respond swiftly to protect Australians as new threats emerge. The AFP’s responsibility is to investigate, prevent and disrupt transnational, complex and organised crime; including terrorism, cybercrime, extremism, drug smuggling and human trafficking. The AFP is also responsible for policing in the ACT and other Australian dependent territories, providing protective security for politicians, embassy staff and dignitaries, United Nations peacekeeping and acting as Australia’s international law enforcement representative.

The AFP has embarked on a initiative to use information and data to proactively identify and disrupt criminal activity, and is seeking multiple high quality data analysts, data engineers and data scientists to join the AFP’s Chief Data Officer branch and assist in developing this vision. These roles will directly contribute to the development of AFP’s disruptive capabilities, and to assist the AFP in dynamically combating crime in the digital age. This recruitment activity is aiming to fulfil multiple positions requiring differing skillsets, if you feel like you have something to offer, we encourage you to apply.

The successful candidate(s) will provide expert consultancy within their area of specialism and develop and promote technical analytical solutions which support the business requirements of the AFP.

As a Team Member in the AFP you will be required to contribute to the achievement of outcomes in accordance with the regulatory framework, the AFP Code of Conduct and the AFP Governance Instruments. It is expected that the successful applicant will deliver on the core responsibilities and meet any requirements of the position as outlined below.

If you are passionate in your role as a senior data specialist, and want to make a real difference to Australia’s security and policing future, we want to hear from you!

Role Description & Responsibilities

We are looking for individuals with experience in one or more of the following specialities: data science, data engineering and/or data analysis. The roles are jointly responsible for developing new capabilities, responding to complex data challenges and performing complex data analyses using advanced analytics technologies.

The roles are part of a small section supporting a highly tactical and operational organisation. We run self-sufficient teams where we have all the skills to develop and operate our data capabilities in the team and use scrum to help structure and manage our workload. This gives our team members great opportunity to both broaden and deepen their skills in today's data challenges across many domains and technologies. While roles recruited through this process will be primarily responsible for one of three specialities: data science, data engineering, or data analysis; we also expect our members to jump in and help the broader team when operational demands hit. We recognise that no candidate is going have experience with all the technologies we use, so instead we’re looking for people with a demonstrated ability to learn and adapt quickly to business demands and technological changes. As such, we’re looking for anyone who sees themselves in any of those roles, or a combination of them.


exhibit strong leadership skills,
take the initiative to solve complex problems under minimal supervision,
work collaboratively and communicate well within a self-sufficient scrum team;
develop and support their own and other team members' technical capabilities,
manage day to day activities, and
prioritise completing business requirements.
Essential Requirements


Bachelor’s degree (or higher/equivalent) in mathematics, statistics, computer science, software engineering, information technology or similar.
A Negative Vetting 1 (Secret) security clearance or the ability to obtain one.
Demonstrated experience in modern data analytics, data science and/or data engineering tools
Demonstrated ability to analyse information through the use of modern data analysis tools and analysis languages to solve business problems. This includes an expectation that members can code in at least one data focused language, i.e. Python, SQL, Cypher, R, SAS or similar.
Demonstrated ability and eagerness to take the initiative to learn new technologies quickly
Desirable Requirements


developing with and using modern Natural Language Processing (NLP) technologies
experience in managing the modern machine learning lifecycle, including ability to deploy and support data science models into a production environment
experience in developing with Python, SpaCy, TensorFlow, Keras or similar.
strong analytical skills related to working with structured and unstructured datasets
understanding of modern artificial intelligence and machine learning technologies and techniques
a demonstrated understanding of the law enforcement or national security domains


experience with modern DevSecOps tools and methodologies.
experience in developing with and deploying either batch or streaming data pipelines with any of the following technologies:
Python
Neo4j
Kafka
NiFi
SAS
Impala
Elasticsearch
PostgreSQL
Java
Experience in designing relational and NoSQL data models (especially graph databases).
A demonstrated understanding of the law enforcement or national security domains


Demonstrated ability to approach and solve complex business problems in innovative ways
Experience in programming and scripting analytical solutions utilising tools such as Python, R or SAS.
Demonstrated ability to communicate solutions to complex problems to key stakeholders
Experience with modern data visualisation tools and business intelligence tools
A demonstrated understanding of the law enforcement or national security domains
Selection Criteria

Achieve results
Communicates with influence
Contributes to strategic thinking
Cultivates productive working relationships
Shows personal drive and integrity
Applying technical knowledge, expertise and skills
Required Application Documents

As part of your application you will be required to submit the following documents:

Applicant response (pitch – maximum two pages)
Resume/CV
Tertiary education certificate/s
Advice for Applicants

Application
All mandatory fields must be completed by the applicant. Applicants must provide all requested documents as outlined above in 'Required Application Documents'.

All requested documents must be uploaded to the online application form and submitted before the closing date and time. Any documents not supplied may result in your application being withdrawn from the recruitment process.

The applicant response (pitch) should address the selection criteria and work level standards relevant to the role and provide evidence as to why you are the best fit for the position. The work level standards are specific to the band level of the role you are applying for and can assist in guiding you to address the selection criteria to the level required of the role.

Employment Suitability Requirements
Applicants, who are not current AFP employees, that progress to the next stage of an AFP recruitment process will be required to provide the following documents:

Completed Employment Suitability Questionnaire (ESQ);
Traffic history for the last 10 years; and
Proof of Australian citizenship.

Applicants will be advised by AFP Recruitment if they are required to provide this information. We encourage all applicants to review the AFP’s minimum employment requirements and employment suitability standards to ensure that you meet the set requirements before you submit your application. Applicants whom do not meet these requirements, or fail to provide the required documents, will be removed from the recruitment process.

For further information on other employment opportunities in the AFP, please visit our website.",3.2,Australian Federal Police (AFP),Canberra,5001 to 10000 Employees,Government,$100 to $500 million (USD),-1,-1,-1
Data Scientist,-1,"READY FOR ANYTHING

At IAG, we live and work by our purpose to make your world a safer place. We are motivated by a unique culture that celebrates honesty, creativity, empathy, equity and collaboration. We call it the IAG way, and it means we all share a ‘ready for anything’ mindset that sets the tone for positive actions and positive outcomes. We put heart into everything we do which guides us to create amazing things for our customers, our people and our communities.

We’re brimming with ideas, ambition and a readiness to apply bold thinking and risk awareness to make a difference where it matters most.",4.0,Insurance Australia Group,Sydney,10000+ Employees,Company - Public,Insurance Operator,Insurance,$10+ billion (USD),-1
Principal Data Scientist,$125K - $135K (Glassdoor Est.),"READY FOR ANYTHING
At IAG, we live and work by our purpose to make your world a safer place. We are motivated by a unique culture that celebrates honesty, creativity, empathy, equity and collaboration. We call it the IAG way, and it means we all share a ‘ready for anything’ mindset that sets the tone for positive actions and positive outcomes. We put heart into everything we do which guides us to create amazing things for our customers, our people and our communities.

We’re brimming with ideas, ambition and a readiness to apply bold thinking and risk awareness to make a difference where it matters most.",4.0,Insurance Australia Group,Sydney,10000+ Employees,Company - Public,Insurance Operator,Insurance,$10+ billion (USD),-1
Data Scientist,-1,"At NTT we believe that by using innovative technology we can solve global challenges and create a world that is sustainable and secure. We are looking for curious people, from diverse backgrounds, that are keen to work in a fast-paced and agile environment.

At NTT we trust our employees to do the right thing, even when no one is watching, which is why we offer flexibility in the workplace. The majority of our roles are hybrid, meaning we encourage a balance of working from home and our local office. Ask our recruitment team if this is a hybrid role.
Want to be a part of our team?
This role is a member of the NTT Products and Services team.

Join our growing automation team where you will deliver innovative solutions across a range of technologies.

The Data Scientist is a key member of the Products and Services team. We are looking for a Data Scientist that will help us discover the information hidden in vast amounts of data, and help us make smarter decisions to deliver even better automations. Your primary focus will be in applying data mining techniques, doing statistical analysis, and building high quality prediction systems integrated with our Automation products. You will work in close collaboration with the Product Owner, the Business Analyst, Solution Architect and the Development Team.

We are looking for an analytical problem solver, an outside-of-the-box thinker who will drive innovation and efficiency – with substantial level of experience of the applicable technologies we work with…... or the ones we should be.

This role supports one or a number of Scrum teams.

The right candidate may be asked to perform a team leadership role within the team.

This role is required to enable a culture of automation first. Working collaboratively with internal and client teams in building NTT’s automation capabilities, identifying & successfully implementing advanced IT automation solutions for NTT and our clients -using the latest industry standards and techniques to build robust, secure and innovative solutions.

Do you inspire and lead the teams you work with to successful outcomes in Agile environment? Do you like to work hard and take pleasure in making your clients successful with innovative solutions across a variety of technologies? If so, then the NTT Products and Services team is a place for you.
We will give you a chance to work with some of the brightest and industry leading projects. You’ll have the support of the team and the leadership in developing your career from day one.",3.6,NTT Ltd,Sydney,1001 to 5000 Employees,2001,Company - Private,Telecommunications Service,Telecommunication,$100 to $500 million (USD)
Data Scientist - 12 mth secondment/FTC,$125K - $145K (Glassdoor Est.),"About Us
Optus’ vision is to become Australia’s most loved everyday brand with lasting customer relationships, a brand that excites customers by bringing together their digital life with their daily lives. The business is focused on designing innovative products and services that entertain customers and enhance their lives, delivered with engaging service and a network where it matters.

About the Role
As a key member of the Data Science chapter, you’ll be responsible for supporting the development of our machine learning analytics capability and helping discover information hidden in vast amounts of data, wrangling and engineering that information into predictive and meaningful features for the Optus Unified Customer Analytics Record (UaR) to support data science initiatives.",3.9,Optus,Sydney,5001 to 10000 Employees,1992,Subsidiary or Business Segment,"Cable, Internet & Telephone Provider",Telecommunication,$2 to $5 billion (USD)
Data scientist,Employer Provided Salary:$163 - $188 Per Hour,"Solving complex, non-routine analysis problems while working with large, complex data sets for a large Government agency
Salary guide:$1300-$1500 per day
Work remotely
Requires demonstrable experience in the past 7 years of:
Solving complex, non-routine analysis problems while working with large, complex data sets.
Apply statistical methods such as parametric and nonparametric significance testing.
Using statistical software (for example, R, Julia, MATLAB, pandas or similar) and database languages (for example, SQL).",-1,MACRO Recruitment,Sydney,Unknown,Company - Private,Unknown / Non-Applicable,-1,-1,-1
Senior Data Scientist- Machine Learning Scientist,-1,"Job Summary
The Senior Data Scientist – Machine Learning Scientist (SDS-MLS) will assist in performing analysis on
physiological and behavioural data sensing and in the development of biomarkers and machine learning
algorithms related to the classification of mental health disorders and stress. The SDS-MLS will entail
working with clinical, psychometric, and ambulatory sensed data related to physiologic signals and
behaviour patterns.
Essential Functions
Collaborate with a team of doctors, engineers, and fellow data scientists around product goals and novel",-1,Medibio,Remote,-1,-1,-1,-1,-1,-1
Data Scientist (Agricultural Systems),Employer Provided Salary:$100K - $108K,"The Opportunity

Apply your data analytics & remote sensing skills in a dynamic long-term role!
Play a vital role in strengthening the digital capabilities of CSIRO’s Agricultural Programs
Great learning & development opportunity to grow your career in R&D sector",3.7,CSIRO,Canberra,5001 to 10000 Employees,1926,Government,National Agencies,Government,$500 million to $1 billion (USD)
Data Scientist - Work with Australia's largest datasets,$95K - $140K (Glassdoor Est.),"General information
Agency: Kinesso
Job Function: Data & Analytics
Location: Sydney, Australia
Job Ref#: 4832
Description & Requirements
Position Summary
The Data Scientist role is a core technical role within the Data Science division of Kinesso. The purpose of the role is to provide audience insights for clients leveraging IPG owned proprietary data assets. This role is responsible in transforming, optimising, and providing efficiencies within our data platforms to facilitate online & offline marketing effectiveness, enabling clients to optimise their marketing budgets, and measuring their business performance by way of data analysis and predictive modelling.",4.1,Kinesso,Sydney,1001 to 5000 Employees,2019,Company - Public,Advertising & Marketing,Business Service,Unknown / Non-Applicable
Data Scientist II,-1,"Data Scientist II
Interested in an inherently cross-functional role that gives you tremendous organizational exposure with senior leaders within the company? You will partner with Marketing, Product, Engineering, and Analytics organization to shape the future of SEM Bidding Data Products and Applications. You will help facilitate cross-team and cross-channel partnerships on shared platforms. In role, you will drive the performance of our algorithms manage the bidding operations for one of the largest channels. You will be the resident expert on data science methods for evaluation and making recommendations to refine and address. Marketing Specialists who are responsible for crafting business cases, operational tests, and growth strategies. Your efforts will guide the SEM to improve company revenue, reduce cost, increase customer engagement, and enhance the value of our brands.

Expedia is committed to creating an inclusive work environment with a diverse workforce. All qualified applicants will receive consideration for employment without regard to race, religion, gender, sexual orientation, national origin, disability or age.",4.1,Expedia,Sydney,10000+ Employees,1996,Company - Public,Internet,Information Technology,$5 to $10 billion (USD)
Position – Data Scientist,$92K - $145K (Glassdoor Est.),"Location – Sydney and Digital / Remote
Experience – Minimum 8 years
We are looking for a candidate with good command over R / Python and in-depth knowledge and experience in Machine Learning, deep learning methods, algorithm design, analysis, development, and performance improvement. Strong understanding of statistical and predictive modeling concepts, machine-learning approaches, clustering, classification, regression techniques, recommendation (collaborative filtering) algorithms and Time series analysis.

We are eager to hear from you if you have one of the below mentioned skills. Send us your resume at careers@robonomics.ai",4.9,Robonomics AI,Sydney,1 to 50 Employees,2016,Company - Private,IT Service,Information Technology,Unknown / Non-Applicable
"Data Scientist/Analyst, (Manufacturing) Hastings VIC",-1,"Job Description

At BlueScope, we create and inspire smart solutions in steel, strengthening our communities and helping build a better future. Our steel has shaped everything from hospitals and schools, bridges and stadiums to fences and homes – influencing the way we live and work, now and in the future.
The Opportunity
Come and discover the opportunity to join our Digital Transformation and Automation team as a Data Scientist/Analyst. Manufacturing at BlueScope have embarked on an exciting enterprise technology transformation, supporting our business and customers now and for the future.",3.0,BlueScope,Hastings,201 to 500 Employees,Company - Private,Construction,"Construction, Repair & Maintenance",$100 to $500 million (USD),-1
Data Scientist - Fraud and Financial Crime - APAC,Employer Provided Salary:$230K,"Use Data Science to uncover fraud and financial crime
Statistical modelling
APAC focused role


My client is the market leader in statistical and analytical software and services and has been going from strength to strength. Due to continued growth they are looking to hire an Analytics Consultant to join their APAC Consulting team.

As the successful Data Scientist you will be working with multiple financial services clients to understand their requirements and help them to combat fraud using statistical modelling and Data Science techniques.

Position responsibilities:
Position requirements:
If you are interested in this fantastic opportunity do not hesitate to apply by clicking on the link below. Alternatively for a confidential discussion please call Matt Garvey on 02 8249 8381.",-1,Eagna Consulting,Sydney,Unknown,Company - Private,Unknown / Non-Applicable,-1,-1,-1
