Job Title,Salary Estimate,Job Description,Rating,Company Name,Location,Size,Founded,Type of ownership,Industry,Sector,Revenue
Data Scientist,$90K - $144K (Glassdoor Est.),"Hiring for one of the big four Auditing firms in Docklands, Melbourne.
6 Months contract on a view to extend
PURPOSE OF THE ROLE:
The project involves redesigning some of our ML models with deep learning and rewriting part of our JAVA code for document layout analysis.
Skillset required for the developer/data scientist are as following :
Machine Learning :
Common machine learning algorithms such as SVM, CRF , Linear Regression, Etc;
Deep Learning, especially RNN , LSTM GRU",4.8,Adaps,Melbourne,1 to 50 Employees,Company - Private,Staffing & Outsourcing,Business Service,Unknown / Non-Applicable,-1
Data Scientist,$100K - $132K (Glassdoor Est.),"Multiple positions
Participate in a sophisticated & cutting-edge simulation solution within Defence
We need you to be able to understand laws of physics and associated mathematics
Holding an Australian AGSVA security clearance is mandatory (Baseline, NV1, or NV2)

The role holder will use data science to assist in qualifying data, understand systems as part of characterisation activities and to leverage empirical data to design models for use in simulations within Defence.



BBBH46258_163177080918807",4.2,Aurec,Melbourne,51 to 200 Employees,2002,Company - Private,Staffing & Outsourcing,Business Service,Unknown / Non-Applicable
Lead Data Scientist,-1,Be one of the first to Apply!,3.3,Davidson Recruitment,Brisbane,51 to 200 Employees,1991,Company - Private,Staffing & Outsourcing,Business Service,Unknown / Non-Applicable
Consultant (Data Science),$90K - $132K (Glassdoor Est.),Be one of the first to Apply!,3.0,Veitch Lister Consulting,Brisbane,51 to 200 Employees,Company - Private,Unknown / Non-Applicable,-1,-1,-1
Lead Data Scientist,-1,"Who We Are

Boston Consulting Group partners with leaders in business and society to tackle their most important challenges and capture their greatest opportunities. BCG was the pioneer in business strategy when it was founded in 1963. Today, we help clients with total transformation-inspiring complex change, enabling organizations to grow, building competitive advantage, and driving bottom-line impact.

To succeed, organizations must blend digital and human capabilities. Our diverse, global teams bring deep industry and functional expertise and a range of perspectives to spark change. BCG delivers solutions through leading-edge management consulting along with technology and design, corporate and digital ventures—and business purpose. We work in a uniquely collaborative model across the firm and throughout all levels of the client organization, generating results that allow our clients to thrive.


BCG GAMMA combines innovative skills in computer science, artificial intelligence, statistics, and machine learning with deep industry expertise. The BCG GAMMA team is comprised of world-class data scientists and business consultants who specialize in the use of advanced analytics to get breakthrough business results. Our teams own the full analytics value-chain end to end: framing new business challenges, building fact-bases, designing innovative algorithms, creating scale through designing tools and apps, and training colleagues and clients in new solutions.",4.4,Boston Consulting Group,Perth,10000+ Employees,1963,Company - Private,Consulting,Business Service,$5 to $10 million (USD)
Machine Learning Engineer,-1,"As a machine learning engineer, it's your job to merge the worlds of data science and software engineering by building robust and scalable machine learning systems. You will be a full-stack machine learning practitioner, responsible for developing and deploying wonderful machine learning pipelines and applications.
We're looking for people passionate about artificial intelligence and learning new things to solve problems. We're also looking for people who have empathy; we want you to think compassionately, and use your intelligence to build applications which minimise harm and treat people fairly.
Our projects and clients vary a lot - but here's a typical snapshot of some of your responsibilities:",4.5,Eliiza,Melbourne,51 to 200 Employees,2017,Company - Private,IT Service,Information Technology,Unknown / Non-Applicable
"Lead, Data Science - Sydney, Brisbane or Melbourne",-1,"READY FOR ANYTHING


At IAG, we live and work by our purpose to make your world a safer place. We are motivated by a unique culture that celebrates honesty, creativity, empathy, equity and collaboration. We call it the IAG way, and it means we all share a ‘ready for anything’ mindset that sets the tone for positive actions and positive outcomes. We put heart into everything we do which guides us to create amazing things for our customers, our people and our communities.",4.0,Insurance Australia Group,Sydney,10000+ Employees,Company - Public,Insurance Operator,Insurance,$10+ billion (USD),-1
Data Science Product Owner,-1,"Annalect is a global data, technology, and analytics consultancy, with offices based in Sydney, Melbourne, Brisbane, and major global hubs. We create solutions across data, measurement, analytics, visualisation, and marketing technology to maximise the effectiveness of media and our client's media ROI.
When we launched Annalect globally in 2011, we dedicated ourselves to transforming the effects of data and analytics on media. Now we have learned to transform the entire marketing process.
Annalect is part of the Omnicom Media Group, and services hundreds of clients across OMD, PHD, Hearts & Science, Resolution Media, Foundation, and OMG United, in addition to working on our own portfolio of direct clients
Our work with PHD won B&T's 2019 award for Best Media Campaign for Children's Panadol, and our work with OMD won B&T's 2019 award for Data Driven Marketing for McDonald's Monopoly.
The role
As the Data Science Product Owner you will be responsible for managing the end to end data environment, delivering business and customer insights and reports that drive strategic priorities and outcomes. You will have a passion for delivering data driven outcomes and have worked in data long enough to have some real wins under your belt. Working alongside the Data Science Lead, you will be required to prioritise and execute new initiatives that align to the strategy, combining the needs of the digital team. From day one you will be responsible for:

About you


Skills and Experience required

Benefits",3.4,OMG Australia,Sydney,51 to 200 Employees,Company - Private,Unknown / Non-Applicable,-1,-1,-1
Senior Data Modeller /Analytics Engineer,-1,"At Deputy we’re on a mission to change the way the world works & we are looking for fantastic people to help us do that. Our mission is to simplify shift work, with a future state vision to enable thriving workplaces in every community.

Deputy is a SaaS Workforce Management Product company. HQ'd in Sydney (AU), with offices in Melbourne, London (UK), Atlanta and San Francisco (USA). We’ve helped hundreds of thousands of people across all industries in 70+ countries save time and money managing their hourly workforce so they can focus on what they do best, and be amazing.

Currently, our employees are predominately working from home and this role will also be remote for the time being. We anticipate employees will be returning to the office, in a flexible capacity, during 2021 as appropriate & when it is safe to do so.",3.9,Deputy,Sydney,201 to 500 Employees,2008,Company - Private,Computer Hardware & Software,Information Technology,Unknown / Non-Applicable
Data Science Product Manager,-1,"WiseTech Global develops next-generation technologies that focus on finding and solving deep problems and core issues in the logistics and supply chain industry. As the global economy grows, our software plays a critical role in solving persistent pain points of logistics via our integrated suite of products. We are looking for a highly technical, data driven whiz to join our Machine Learning team.
So, who are we looking for?
Building data-driven products is your passion. You are proactive and self-driven. You excel at identifying product improvement opportunities across the business and drive them to completion. Your communication skills help you to work with a wide range of stakeholders, of various technical proficiency, level and background. You can explain complex concepts in simple terms but can delve deep if required.",4.0,WiseTech Global,Sydney,1001 to 5000 Employees,1994,Company - Public,Computer Hardware & Software,Information Technology,$100 to $500 million (USD)
Senior Data Scientist (3 positions available!),-1,"This is a rare and exciting opportunity for 3 Sr. Data Scientists to join a Global Tech Company to help build their Australian Centre of Excellence and be part of a global team of over 40 Data Scientists. The company is Adelaide based, but they are open to receiving applications from top talent all over Australia.
Educational Qualifications:
Bachelors, Master's or PhD degree from reputed universities or institutes in one of the following disciplines:
Artificial Intelligence / Machine Learning
Cognitive Computing
Computational Linguistics",3.9,Hudson,Adelaide,501 to 1000 Employees,1985,Company - Private,Staffing & Outsourcing,Business Service,Unknown / Non-Applicable
"Strategy Consultant Data Science, Economics, Public Policy",-1,"AlphaBeta Australia, now officially part of Accenture Strategy, is a leading strategy consultancy with offices in Sydney, Melbourne and Canberra.
We specialise in combining strategy consulting, data science and economics expertise to solve issues that matter – issues like the future of work, social services, economic recovery and climate change. Our projects help reshape industries, government policies and public thinking, and we’re seeking talented and driven problem-solvers to help us grow.
The role
Consultants lead key portions our projects and have direct contact with senior clients. They are responsible for identifying issues, forming practical hypotheses, planning and conducting interviews, undertaking data analysis, developing conclusions into recommendations and helping to implement change.
As a consultant, you will work in close-knit teams with managers and senior managers who will help build your core consulting skills. Our firm is committed to your professional development and to building your core competencies in:
1. Problem solving: Developing high impact solutions for clients
2. Knowledge development: Providing deep and relevant insights into economic and public policy issues for clients
3. Client leadership: Building enduring, trust-based relationships with clients
4. Entrepreneurship: Looking for new opportunities for client impact
5. People leadership: Strong teamwork and inspiring others
6. Values leadership: Demonstrating strong ethics and partnerships
AlphaBeta looks for candidates who are intellectually curious and have an outstanding track record. This role would be ideal for candidates who want to work on the most interesting challenges in the private and public sectors.
What we look for",3.8,Accenture,Melbourne,10000+ Employees,1989,Company - Public,Consulting,Business Service,$10+ billion (USD)
Data Scientist,-1,Be one of the first to Apply!,-1,In Marketing We Trust,Australia,-1,-1,-1,-1,-1,-1
Data Scientist - Actuarial,$95K - $108K (Glassdoor Est.),"Date: 13-Oct-2021

Location:
Sydney, NSW, AU

Department:Description:
Job Requisition ID: 18609

About Deloitte

Flexibility, opportunity and incredible experiences reward the hard work required to succeed at Deloitte. We champion and support our talented people in achieving their career goals and collectively celebrate success.

Join a high performing culture of talented people, who are highly motivated and passionate about building and implementing information based solutions. We are innovative and different because YOU are… we pride ourselves on our team of diverse, high performing Deloitte Professionals who are talented, supportive, inclusive and social - and who are at the heart of our success. Our aim is to ensure that all our people feel comfortable to bring their whole selves to work, and as a result, create a workplace that encourages the true spirit of 'And different'.

From day one at our firm you’ll be considered part of the Deloitte community and our development and career progression framework will help you develop the skills and capabilities you need to succeed - in every sense of the word. At Deloitte, we assume that you perform other roles within your life….you could be a student, a teacher, a passionate hobbyist and a caring family member. We recognise the importance of balance and embrace agility, understanding that this means different things to each and every one of our employees.

About the Team

We are a team of talented Actuaries, Data Scientists and Quants who love to use our unique blend of technical and commercial expertise. Coupling the power of data with our human-centred approach, we solve client problems with a deep appreciation of behavioural science. We provide clients with end-to-end quantitative solutions, from strategic advice, data management and modelling, to the final execution.

Working between our Business Algorithms team, you will have the opportunity to:

This role will provide deep statistical, mathematical and financial expertise to support the team’s core purpose of providing technical quantitative advice and analytics solutions to achieve the strategic business’ goals.

About you

To be considered for this role, critical to your success will be your knowledge and experience in:

What we will provide you

You will be trained in core technical skills, but also to be able to think creatively and innovatively. We will work to give you projects with a wide range of professionals across Deloitte, and learn first-hand how quantitative skillsets can be combined with other competencies to create a leading solution to a problem.

We offer great study support packages for relevant qualifications along with a range of technical and non-technical training opportunities.

We will also provide you with one of the strongest project management training available in the actuarial market.

Like many financial services’ roles, a significant portion of what we currently do today may not exist in 5-10 years’ time, and our focus on innovation and creative thinking will prepare you and your career to be part of that next-generation of Actuaries, Data Scientists and Quants.",3.9,Deloitte,Sydney,10000+ Employees,1850,Company - Private,Accounting,Accounting & Legal,$10+ billion (USD)
Data Scientist,$105K - $119K (Glassdoor Est.),Be one of the first to Apply!,4.3,REA Group,Sydney,501 to 1000 Employees,1995,Company - Public,Real Estate,Real Estate,$100 to $500 million (USD)
Junior Data Scientist,-1,"Company Description

Nine is Australia’s largest locally owned media company with investments spanning television, video on demand, print, digital, and radio. Nine’s assets include the Nine Television Network, video on demand platform 9Now, talkback radio stations 2GB, 3AW, 4BC and 6PR, major mastheads such as The Sydney Morning Herald, The Age and Australian Financial Review, digital properties such as nine.com.au, 9Honey, Pedestrian.TV and CarAdvice, subscription video platform Stan, and majority investments in Domain and Future Women.

Job Description",3.6,Nine,North Sydney,1001 to 5000 Employees,2004,Company - Private,TV Broadcasting & Cable Network,Media,$1 to $2 billion (USD)
Analyst | Data & Analytics,Employer Provided Salary:$40K - $58K,Be one of the first to Apply!,-1,Disseny 360,Hobart,-1,-1,-1,-1,-1,-1
"Senior Data Scientist, ESG Innovation and Analytics",Employer Provided Salary:$83K - $230K,"The Role: Senior Data Scientist, ESG Innovation and Analytics
Grade: 12 (internal use only)
Location: London UK, New York, Boston US, Sydney, AU

The Role: S&P Global Trucost is a leader in ESG data and risk analysis, providing data, tools and insights to companies and financial institutions for the last 18 years in order to inform capital allocation to more sustainable business models and better communicate ESG performance to their stakeholders.
We are looking for an experienced Senior Data Scientist based in London to join our ESG Innovation and Analytics Team, part of S&P Global’s newly formed ESG Organization (Sustainable1). The role will focus on building and growing the team’s capabilities in data science with a strong focus on geospatial and big data analysis. The role provides an opportunity to work on a variety of cutting-edge projects in the field of sustainable finance.

In this role, you will be working across a diverse range of ESG issues covering climate change, ecosystems, biodiversity and more. With the support of the Head of Data Innovation you will lead the team’s work in this space.

S&P Global Trucost’s expertise is providing data leveraged analytics and insights on ESG performance so that businesses and investors can understand how to direct investments that create value and avoid risk. We’ve been informing companies, financial institutions, regulators and thought leaders since 2000. S&P Global Trucost’s carbon data underpins the S&P Global Carbon Efficient Index series selected by Government Pension Investment fund for Japan (GPIF) to serve as the benchmark for their ESG investment strategy. S&P Global Trucost’s clients also include DBS Bank, ERAFP, Fidelity, Future Fund, Goldman Sachs, HSBC, State Street Global Advisors and UBS among many others.

Our team is composed of experienced professionals driven to identify the transformative solutions of tomorrow. The business has a casual and friendly atmosphere with an entrepreneurial spirit. We value teamwork and it is crucial that you are a team player to be successful within our organization.

“I am looking for a seasoned Data Scientist with extensive experience in applying geospatial data science to lead on the development of new datasets and analytics to support business and investment decision-making. You must be passionate about using data to answer complex sustainability questions”.


S&P Global states that the anticipated base salary range for this position is $ 82,600 to $230,200 . Base salary ranges may vary by geographic location.
In addition to base compensation, this role is eligible for an annual incentive plan. This role is not eligible for additional compensation such as an annual incentive bonus or sales commission plan.
This role is eligible to receive additional S&P Global benefits. For more information on the benefits we provide to our employees, visit https://www.spgbenefitessentials.com/newhires


Work with and coordinating interdisciplinary teams and projects at the intersection of large-scale datasets, geospatial analytics, remote sensing and machine learning

Conduct geospatial, remote sensing and other advanced statistical data analyses

Ensure high degree of confidence in the data products including but not limited to developing QA/QC strategies to ensure they are platform-ready

Manage key components of ongoing projects with internal and external partners, including but not limited to Technology Teams, Product Teams, Data Management Teams as well as external stakeholders or data providers

Clearly communicate insights and technical approaches verbally and in writing, including documenting analytical methodologies and other outputs appropriate for use by specialist as well as non-specialists

Work collaboratively with a diverse team across multiple locations to conduct analysis and ensure the quality of insights

Help develop reports, factsheets, blog posts, and other materials for general and specific audiences on the topics of focus

Provide feedback from the market to help shape S&P Global’s ESG product innovation roadmap


Strong quantitative background in geospatial data analytics and tools (e.g. geostatistics and related applications to GIS and remote sensing data, and GIS tools)

Experience in machine learning will be viewed favourably

Experience working with large geospatial and satellite datasets is highly desired

Strong proficiency in scientific programming languages (Python preferred)

Demonstrated skills in data and project management

Intellectual agility and comfort with working on a wide variety of environmental topics.

Excellent written and oral communication skills

Experience translating quantitative geospatial analytical information for non-specialist audiences

Ability to work independently and support a multi-disciplinary team, using independent judgment to plan, prioritize, and organize a diverse workload in a fast-paced environment

Demonstrated self-awareness, cultural competency and inclusivity, and ability to work with colleagues and stakeholders across diverse cultures and backgrounds

Self-motivated, organized, detail-oriented, with a positive, “can do” attitude


10+ years of relevant industry experience including leadership of complex projects

Proven experience managing analysis / data science teams

Experience working with GIS systems and geospatial data

MS degree in an analytical field (e.g. Statistics, Economics, Applied Math, Operations Research, Physics, and Data Science) or extensive track record as a data science practitioner.

Consulting skills, (e.g. ability to help define business problems, propose and gain alignment on solutions, and execute the implementation)

Able to convey complex information in an understandable, compelling, and persuasive manner to senior executives

Direct experience and the ability to use and coach others a range of modern data science, analytics, and reporting tools (e.g., Python, R, Dash, Hadoop, Spark, Alteryx, ESRI, SAS, SQL)

Prior financial services experience will be looked upon favourably but is not a prerequisite

S&P Global Corporate
At S&P Global, we don’t give you intelligence—we give you essential intelligence. The essential intelligence you need to make decisions with conviction. We’re the world’s foremost provider of credit ratings, benchmarks and analytics in the global capital and commodity markets. Our divisions include S&P Global Ratings, S&P Global Market Intelligence, S&P Dow Jones Indices and S&P Global Platts. For more information, visit www.spglobal.com .

S&P Global has a Securities Disclosure and Trading Policy (“the Policy”) that seeks to mitigate conflicts of interest by monitoring and placing restrictions on personal securities holding and trading. The Policy is designed to promote compliance with global regulations. In some Divisions, pursuant to the Policy’s requirements, candidates at S&P Global may be asked to disclose securities holdings. Some roles may include a trading prohibition and remediation of positions when there is an effective or potential conflict of interest. Employment at S&P Global is contingent upon compliance with the Policy.


S&P Global is an equal opportunity employer committed to making all employment decisions without regard to race/ethnicity, sex, pregnancy, gender identity or expression, color, creed, religion, national origin, age, disability, marital status (including domestic partnerships and civil unions), sexual orientation, military veteran status, unemployment status, or other legally protected categories, subject to applicable law.
If you need an accommodation during the application process due to a disability, please send an email to: EEO.Compliance@spglobal.com and your request will be forwarded to the appropriate person.


The EEO is the Law Poster http://www.dol.gov/ofccp/regs/compliance/posters/pdf/eeopost.pdf describes discrimination protections under federal law.

#LI-NJ1

10 - Officials or Managers (EEO-2 Job Categories-United States of America), PDMGDV103.2 - Middle Management Tier II (EEO Job Group), SWP Priority – Ratings - (Strategic Workforce Planning)

260364
2021-09-16
London, United Kingdom",4.1,S&P Global,Sydney,10000+ Employees,1888,Company - Public,Financial Analytics & Research,Finance,$5 to $10 billion (USD)
Data Scientist,$150K - $181K (Glassdoor Est.),Be one of the first to Apply!,3.7,Publicis Groupe,Pyrmont,10000+ Employees,1926,Company - Private,Advertising & Marketing,Business Service,$5 to $10 billion (USD)
Data Scientist,-1,"Company Description

Life at Nine.
Nine’s strategy is to create great content, distribute it broadly and engage audiences and advertisers.
We are Australia’s largest locally owned media company – the home of Australia’s most trusted and loved brands spanning News, Sport, Lifestyle, and Entertainment.
Nine’s assets include the Nine Network, major mastheads such as The Sydney Morning Herald, The Age and The Australian Financial Review, Nine Radio, digital properties such as nine.com.au, 9Now, 9Honey, Pedestrian.TV, subscription video platform Stan and majority investments in Domain Group and Drive.",3.6,Nine,North Sydney,1001 to 5000 Employees,2004,Company - Private,TV Broadcasting & Cable Network,Media,$1 to $2 billion (USD)
Data Scientist,$90K - $103K (Glassdoor Est.),"Data Scientist – Applied Intelligence
Harness the power of data and artificial intelligence to accelerate change.
Join our Applied Intelligence team and create innovative, forward thinking and life changing solutions using cutting-edge technologies. We are changing the world fast, come with us.
Your role: Data Scientist
You will advise on and lead AI applications for our existing and prospective clients and deliver value. This will be primarily focused on virtual agent work but will differ pending on client needs.",3.8,Accenture,Sydney,10000+ Employees,1989,Company - Public,Consulting,Business Service,$10+ billion (USD)
